{
    "$schema": "https://json-schema.org/draft/2020-12/schema",
    "$id": "https://github.com/hmustafademir/data-on-the-web/blob/master/sports.schema.json",
    "title": "Sports",
    "description": "List of sport events.",
    "type": "array",
    "items": {
        "type": "object",
        "description": "Event.",
        "properties": {
            "ID": {
                "type": "integer",
                "description": "The unique event code."
            },
            "location": {
                "type": "object",
                "description": "The location description.",
                "properties": {
                    "city": {
                        "type": "object",
                        "description": "City.",
                        "properties": {
                            "ID": {
                                "type": "integer",
                                "description": "The unique city code."
                            },
                            "name": {
                                "type": "string",
                                "description": "The city name."
                            }
                        }
                    },
                    "postcode": {
                        "type": "integer",
                        "description": "The city postcode."
                    },
                    "street": {
                        "type": "string",
                        "description": "The street name."
                    },
                    "street_number": {
                        "type": "integer",
                        "description": "The street number."
                    }
                }
            },
            "date": {
                "type": "object",
                "description": "The date description.",
                "properties": {
                    "date": {
                        "type": "string",
                        "format": "date",
                        "description": "The date of the event."
                    },
                    "dateTime_start": {
                        "type": "string",
                        "format": "date-time",
                        "description": "The exact start date of the event."
                    },
                    "dateTime_end": {
                        "type": "string",
                        "format": "date-time",
                        "description": "The exact end date of the event."
                    }
                }
            },
            "title": {
                "type": "string",
                "description": "The title of the event."
            },
            "type": {
                "type": "string",
                "description": "The sport type of the event."
            },
            "description": {
                "type": "string",
                "description": "The event description."
            }
        },
        "required": [
            "ID"
        ]
    }
}